{
  "schemaVersion": 1,
  "taskId": ".scratch/harness-integrity/issues/01-harness-integrity.md",
  "baseRevision": "0e64da182604655a6d09a127781593423ac2197f",
  "candidateRevision": "sha256:a9e37649823aad84a16d15ebb317013a50d14f0e15986c20f9937257a1bcd1f5",
  "producerId": "final-integrity-review",
  "independent": true,
  "verdict": "pass",
  "findings": [],
  "commentDecisions": [],
  "evidence": [
    {
      "checkId": "review.trusted-integrity",
      "status": "passed",
      "evidenceRef": "scripts/quality-integrity.mjs",
      "evidenceSha256": "a1fd0eae6ca38e1a483c7a74cb0d4385310e3799a3378d892122b7cb41543fe3"
    }
  ],
  "residualRisks": [
    "The trusted-policy check and CODEOWNER review become enforceable only after this bootstrap workflow is merged and configured as a required branch-protection check."
  ]
}
